Title,Author,Lenght
Graves on the Fens,By: Joy Ellis,Length: 10 hrs and 50 mins
East of Eden,"By: John Steinbeck, David Wyatt - introduction",Length: 26 hrs and 43 mins
Liar's Poker,By: Michael Lewis,Length: 10 hrs and 16 mins
Angron: The Red Angel,By: David Guymer,Length: 10 hrs and 57 mins
The Turning of Our Bones,By: Ed James,Length: 12 hrs and 49 mins
Wild Fell,By: Lee Schofield,Length: 8 hrs and 56 mins
In at the Kill,By: Gerald Seymour,Length: 17 hrs and 38 mins
You Had Me at Hello,By: Mhairi McFarlane,Length: 10 hrs and 25 mins
Healing Hearts at Bumblebee Barn,By: Jessica Redland,Length: 9 hrs and 21 mins
Unleashed,By: Joshua Dalzelle,Length: 8 hrs and 27 mins
I'm Sorry I Haven't a Clue Treasury,By: BBC Radio Comedy,Length: 18 hrs and 38 mins
Damascus Station,By: David McCloskey,Length: 12 hrs and 48 mins
Building Microservices,By: Sam Newman,Length: 21 hrs and 12 mins
Torith,By: SunriseCV,Length: 14 hrs and 16 mins
The Standoff,By: Scott Blade,Length: 13 hrs and 49 mins
Earthside,By: Dennis E. Taylor,Length: 8 hrs and 55 mins
Magitech Chronicles Omnibus,By: Chris Fox,Length: 108 hrs and 51 mins
Love Will Tear Us Apart,By: C. K. McDonnell,Length: 13 hrs and 23 mins
Not That Kind of Girl,By: Lena Dunham,Length: 6 hrs and 9 mins
From the Oasthouse: The Alan Partridge Podcast (Series 2),By: Alan Partridge,Length: 4 hrs and 15 mins
